{
  "schemaVersion": 1,
  "application": "Asteria",
  "buildKind": "synthetic-fixture",
  "sourceRevision": "synthetic-not-a-build",
  "releaseBaseline": "v0.3.0-immutable-reference",
  "architecture": "synthetic",
  "gpu": "synthetic-no-GPU",
  "driver": null,
  "backend": "SYNTHETIC",
  "codec": {
    "name": "PyroWave",
    "commit": "186f0393b77f7755953b5ecde994bb1cec2e4155",
    "bitstreamId": "186f0393",
    "apiVersion": "0.6.0"
  },
  "video": {
    "width": 1920,
    "height": 1080,
    "targetFps": 60,
    "requestedBitrateKbps": 200000,
    "vsync": true
  },
  "capture": {
    "durationSeconds": 60,
    "requestedDurationSeconds": 60,
    "warmupSeconds": 10,
    "counterOverflow": false
  },
  "metrics": {
    "networkReassembly": {
      "unit": "us",
      "scope": "CPU:first_packet_to_decode_unit_enqueue",
      "clock": "common-c monotonic",
      "status": "unavailable",
      "sampleCount": 0,
      "percentileMethod": "nearest-rank-log2-8-upper-bound",
      "mean": null,
      "p50": null,
      "p95": null,
      "p99": null,
      "minimum": null,
      "maximum": null
    },
    "frameAssembly": {
      "unit": "us",
      "scope": "CPU:transport_fragment_copy",
      "clock": "common-c monotonic",
      "status": "available",
      "sampleCount": 10,
      "percentileMethod": "nearest-rank-log2-8-upper-bound",
      "mean": 10,
      "p50": 10,
      "p95": 10,
      "p99": 10,
      "minimum": 10,
      "maximum": 10
    },
    "parserPreparation": {
      "unit": "us",
      "scope": "CPU:parser_packet_push_output_setup",
      "clock": "steady_clock",
      "status": "unavailable",
      "sampleCount": 0,
      "percentileMethod": "nearest-rank-log2-8-upper-bound",
      "mean": null,
      "p50": null,
      "p95": null,
      "p99": null,
      "minimum": null,
      "maximum": null
    },
    "decoderQueueWait": {
      "unit": "us",
      "scope": "CPU:enqueue_to_submit_callback",
      "clock": "common-c monotonic",
      "status": "unavailable",
      "sampleCount": 0,
      "percentileMethod": "nearest-rank-log2-8-upper-bound",
      "mean": null,
      "p50": null,
      "p95": null,
      "p99": null,
      "minimum": null,
      "maximum": null
    },
    "gpuDecodeSubmission": {
      "unit": "us",
      "scope": "CPU:async_codec_decode_api",
      "clock": "steady_clock",
      "status": "unavailable",
      "sampleCount": 0,
      "percentileMethod": "nearest-rank-log2-8-upper-bound",
      "mean": null,
      "p50": null,
      "p95": null,
      "p99": null,
      "minimum": null,
      "maximum": null
    },
    "cpuDecodeReadback": {
      "unit": "us",
      "scope": "CPU:synchronous_codec_decode_and_I420_readback",
      "clock": "steady_clock",
      "status": "unavailable",
      "sampleCount": 0,
      "percentileMethod": "nearest-rank-log2-8-upper-bound",
      "mean": null,
      "p50": null,
      "p95": null,
      "p99": null,
      "minimum": null,
      "maximum": null
    },
    "frameInterarrival": {
      "unit": "us",
      "scope": "network:first_packet_of_successive_delivered_decode_units",
      "clock": "common-c monotonic",
      "status": "unavailable",
      "sampleCount": 0,
      "percentileMethod": "nearest-rank-log2-8-upper-bound",
      "mean": null,
      "p50": null,
      "p95": null,
      "p99": null,
      "minimum": null,
      "maximum": null
    },
    "decodePublicationInterval": {
      "unit": "us",
      "scope": "CPU:successive_output_publications",
      "clock": "steady_clock",
      "status": "unavailable",
      "sampleCount": 0,
      "percentileMethod": "nearest-rank-log2-8-upper-bound",
      "mean": null,
      "p50": null,
      "p95": null,
      "p99": null,
      "minimum": null,
      "maximum": null
    },
    "newFrameSubmissionInterval": {
      "unit": "us",
      "scope": "CPU:successive_new_video_submissions",
      "clock": "steady_clock",
      "status": "unavailable",
      "sampleCount": 0,
      "percentileMethod": "nearest-rank-log2-8-upper-bound",
      "mean": null,
      "p50": null,
      "p95": null,
      "p99": null,
      "minimum": null,
      "maximum": null
    },
    "renderSchedulingInterval": {
      "unit": "us",
      "scope": "CPU:successive_main_thread_render_entries",
      "clock": "steady_clock",
      "status": "unavailable",
      "sampleCount": 0,
      "percentileMethod": "nearest-rank-log2-8-upper-bound",
      "mean": null,
      "p50": null,
      "p95": null,
      "p99": null,
      "minimum": null,
      "maximum": null
    },
    "frameAgeAtPickup": {
      "unit": "us",
      "scope": "CPU:output_publication_to_renderer_pickup",
      "clock": "steady_clock",
      "status": "unavailable",
      "sampleCount": 0,
      "percentileMethod": "nearest-rank-log2-8-upper-bound",
      "mean": null,
      "p50": null,
      "p95": null,
      "p99": null,
      "minimum": null,
      "maximum": null
    },
    "renderLoop": {
      "unit": "us",
      "scope": "CPU:main_thread_render_entry_to_exit_including_stats_overlays_retries",
      "clock": "steady_clock",
      "status": "unavailable",
      "sampleCount": 0,
      "percentileMethod": "nearest-rank-log2-8-upper-bound",
      "mean": null,
      "p50": null,
      "p95": null,
      "p99": null,
      "minimum": null,
      "maximum": null
    },
    "vulkanQueueSubmitCall": {
      "unit": "us",
      "scope": "CPU:vkQueueSubmit_call_excluding_queue_mutex",
      "clock": "steady_clock",
      "status": "unavailable",
      "sampleCount": 0,
      "percentileMethod": "nearest-rank-log2-8-upper-bound",
      "mean": null,
      "p50": null,
      "p95": null,
      "p99": null,
      "minimum": null,
      "maximum": null
    },
    "vulkanPresentCall": {
      "unit": "us",
      "scope": "WSI:vkQueuePresentKHR_call_excluding_queue_mutex",
      "clock": "steady_clock",
      "status": "unavailable",
      "sampleCount": 0,
      "percentileMethod": "nearest-rank-log2-8-upper-bound",
      "mean": null,
      "p50": null,
      "p95": null,
      "p99": null,
      "minimum": null,
      "maximum": null
    },
    "overlayUploadCpu": {
      "unit": "us",
      "scope": "CPU:native_overlay_prepare_and_upload_command_recording",
      "clock": "steady_clock",
      "status": "unavailable",
      "sampleCount": 0,
      "percentileMethod": "nearest-rank-log2-8-upper-bound",
      "mean": null,
      "p50": null,
      "p95": null,
      "p99": null,
      "minimum": null,
      "maximum": null
    },
    "swapchainRecreation": {
      "unit": "us",
      "scope": "CPU:successful_recreation_including_existing_drain",
      "clock": "steady_clock",
      "status": "unavailable",
      "sampleCount": 0,
      "percentileMethod": "nearest-rank-log2-8-upper-bound",
      "mean": null,
      "p50": null,
      "p95": null,
      "p99": null,
      "minimum": null,
      "maximum": null
    },
    "decoderInitialization": {
      "unit": "us",
      "scope": "per-lifetime:decoder_initialize_including_provenance_preflight",
      "clock": "steady_clock",
      "status": "unavailable",
      "sampleCount": 0,
      "percentileMethod": "nearest-rank-log2-8-upper-bound",
      "mean": null,
      "p50": null,
      "p95": null,
      "p99": null,
      "minimum": null,
      "maximum": null
    },
    "decoderCleanup": {
      "unit": "us",
      "scope": "per-lifetime:decoder_destructor_resources_excluding_export",
      "clock": "steady_clock",
      "status": "unavailable",
      "sampleCount": 0,
      "percentileMethod": "nearest-rank-log2-8-upper-bound",
      "mean": null,
      "p50": null,
      "p95": null,
      "p99": null,
      "minimum": null,
      "maximum": null
    },
    "hostProcessing": {
      "unit": "us",
      "scope": "host:RTP_reported_processing_latency",
      "clock": "host",
      "status": "unavailable",
      "sampleCount": 0,
      "percentileMethod": "nearest-rank-log2-8-upper-bound",
      "mean": null,
      "p50": null,
      "p95": null,
      "p99": null,
      "minimum": null,
      "maximum": null
    },
    "estimatedRtt": {
      "unit": "us",
      "scope": "network:common-c_estimate_sampled_at_overlay_refresh",
      "clock": "common-c estimate",
      "status": "unavailable",
      "sampleCount": 0,
      "percentileMethod": "nearest-rank-log2-8-upper-bound",
      "mean": null,
      "p50": null,
      "p95": null,
      "p99": null,
      "minimum": null,
      "maximum": null
    }
  },
  "counts": {
    "receivedFrames": 10,
    "newVideoSubmissions": 10
  },
  "limitations": [
    "Synthetic deterministic fixture; not hardware evidence"
  ],
  "frameEvents": []
}
